{
  "schemaVersion": "1.0.0",
  "project": "innate-labs",
  "generatedAt": "2026-10-28T04:10:22.628Z",
  "sources": [
    {
      "path": "docs/sprints/S0-w0-baseline.md",
      "sha256": "27780068ee4c4414c4d263194545cbea4af2df9443a5ad032c2c2910b8f413dc"
    },
    {
      "path": "docs/sprints/S1-w1a-base.md",
      "sha256": "842f03cd2bf92fe51314d48568de5c1ee15ce8ab9ca1631472888a69f219ee44"
    },
    {
      "path": "docs/sprints/S2-w1b-shell.md",
      "sha256": "393718880e859a2a533dd4eccdd9d1275163a98c27231cf94808278771855974"
    },
    {
      "path": "docs/sprints/S3-w1c-tabs.md",
      "sha256": "c1ce0072a7faca3fc39faf1162d527b10bef3b5e7528e9cae48da0cb764c758e"
    },
    {
      "path": "docs/sprints/S4-w2-gateway.md",
      "sha256": "75cfd26f0eeafa64d68dab4329eb10a4f1167d85094bf3ea396411a292eda3e6"
    },
    {
      "path": "docs/sprints/S5-w3-workspace.md",
      "sha256": "d205d1f442f82710348ce84df7806bf4f4557ad0c3f32837f82b4c1e32994e10"
    },
    {
      "path": "docs/sprints/S6-w4-terminal.md",
      "sha256": "dc2fe97cc10ea6d7780fe096243bee681c06c6fb69711c11dd43aa5c06769112"
    },
    {
      "path": "docs/sprints/S7-w5-browser.md",
      "sha256": "525b82c4527b2ff799705bbc523b268444c12d05d2e36ba6f141b41bc66a489d"
    },
    {
      "path": "docs/sprints/S8-r1-harness.md",
      "sha256": "57a763efa011902bf48d6d30392417190719c9934cb3ca1b4e9f51e744b66ce1"
    },
    {
      "path": "docs/sprints/S9-q1-plan.md",
      "sha256": "7f35c255b6ddf10e210ab8d58599eb05bea5c67d6430a356cd699d022712c191"
    },
    {
      "path": "docs/sprints/S10-q2-canvas.md",
      "sha256": "93090cfa3ee390a0e00c082f2dbeeef7f58252eaf5403ab2948079e1c9b2c4c2"
    },
    {
      "path": "docs/sprints/S11-q3-task.md",
      "sha256": "b585e5ec375bfadfe39eb3d490db2ecc0252492cc2f5d5add27e2ffd596d43b1"
    }
  ],
  "sprints": [
    {
      "id": "S0",
      "title": "W0 基线迁入",
      "estimate": "2–3 人日",
      "declaredStatus": "待执行",
      "source": {
        "path": "docs/sprints/S0-w0-baseline.md",
        "sha256": "27780068ee4c4414c4d263194545cbea4af2df9443a5ad032c2c2910b8f413dc"
      }
    },
    {
      "id": "S1",
      "title": "W1a UI 基座+titlebar",
      "estimate": "1–2 人日",
      "declaredStatus": "待执行",
      "source": {
        "path": "docs/sprints/S1-w1a-base.md",
        "sha256": "842f03cd2bf92fe51314d48568de5c1ee15ce8ab9ca1631472888a69f219ee44"
      }
    },
    {
      "id": "S2",
      "title": "W1b 壳组合",
      "estimate": "1–2 人日",
      "declaredStatus": "待执行",
      "source": {
        "path": "docs/sprints/S2-w1b-shell.md",
        "sha256": "393718880e859a2a533dd4eccdd9d1275163a98c27231cf94808278771855974"
      }
    },
    {
      "id": "S3",
      "title": "W1c 中栏多标签",
      "estimate": "2–3 人日",
      "declaredStatus": "待执行",
      "source": {
        "path": "docs/sprints/S3-w1c-tabs.md",
        "sha256": "c1ce0072a7faca3fc39faf1162d527b10bef3b5e7528e9cae48da0cb764c758e"
      }
    },
    {
      "id": "S4",
      "title": "W2 网关收口",
      "estimate": "3–4 人日",
      "declaredStatus": "待执行",
      "source": {
        "path": "docs/sprints/S4-w2-gateway.md",
        "sha256": "75cfd26f0eeafa64d68dab4329eb10a4f1167d85094bf3ea396411a292eda3e6"
      }
    },
    {
      "id": "S5",
      "title": "W3 工作区",
      "estimate": "3–5 人日",
      "declaredStatus": "待执行",
      "source": {
        "path": "docs/sprints/S5-w3-workspace.md",
        "sha256": "d205d1f442f82710348ce84df7806bf4f4557ad0c3f32837f82b4c1e32994e10"
      }
    },
    {
      "id": "S6",
      "title": "W4 terminal",
      "estimate": "4–6 人日",
      "declaredStatus": "待执行",
      "source": {
        "path": "docs/sprints/S6-w4-terminal.md",
        "sha256": "dc2fe97cc10ea6d7780fe096243bee681c06c6fb69711c11dd43aa5c06769112"
      }
    },
    {
      "id": "S7",
      "title": "W5 browser",
      "estimate": "3–5 人日",
      "declaredStatus": "待执行",
      "source": {
        "path": "docs/sprints/S7-w5-browser.md",
        "sha256": "525b82c4527b2ff799705bbc523b268444c12d05d2e36ba6f141b41bc66a489d"
      }
    },
    {
      "id": "S8",
      "title": "R1 Harness 收敛",
      "estimate": "2–3 人日",
      "declaredStatus": "待执行",
      "source": {
        "path": "docs/sprints/S8-r1-harness.md",
        "sha256": "57a763efa011902bf48d6d30392417190719c9934cb3ca1b4e9f51e744b66ce1"
      }
    },
    {
      "id": "S9",
      "title": "Q1 计划生成",
      "estimate": "3–5 人日",
      "declaredStatus": "待执行",
      "source": {
        "path": "docs/sprints/S9-q1-plan.md",
        "sha256": "7f35c255b6ddf10e210ab8d58599eb05bea5c67d6430a356cd699d022712c191"
      }
    },
    {
      "id": "S10",
      "title": "Q2 项目看板",
      "estimate": "3–4 人日",
      "declaredStatus": "待执行",
      "source": {
        "path": "docs/sprints/S10-q2-canvas.md",
        "sha256": "93090cfa3ee390a0e00c082f2dbeeef7f58252eaf5403ab2948079e1c9b2c4c2"
      }
    },
    {
      "id": "S11",
      "title": "Q3 单任务执行",
      "estimate": "5–7 人日",
      "declaredStatus": "待执行",
      "source": {
        "path": "docs/sprints/S11-q3-task.md",
        "sha256": "b585e5ec375bfadfe39eb3d490db2ecc0252492cc2f5d5add27e2ffd596d43b1"
      }
    }
  ],
  "tasks": [
    {
      "id": "T0.1",
      "sprintId": "S0",
      "title": "W0.1 冻结源基线并建立迁移清单",
      "status": "todo",
      "summary": "记录 labs 与本仓 commit/工作区/版本；在 labs 实测 build/typecheck/test/check:typescript/verify:overlay/smoke:desktop 并记录实测测试数；列迁移白名单（innate-dogic、tools、innate-project-canvas、根配置）与排除项；magpie.exe 记录版本与哈希。",
      "purpose": "迁移源可复现，范围无歧义。",
      "verification": "白名单每个包映射到目标路径；排除项不进清单。",
      "estimate": "0.5 天",
      "blockedBy": [],
      "evidence": [],
      "source": {
        "path": "docs/sprints/S0-w0-baseline.md",
        "sha256": "27780068ee4c4414c4d263194545cbea4af2df9443a5ad032c2c2910b8f413dc",
        "line": 3
      }
    },
    {
      "id": "T0.2",
      "sprintId": "S0",
      "title": "W0.2 在源基线修复启动日志脱敏",
      "status": "todo",
      "summary": "labs 侧 harness.ts 与 services/harness-runtime 增加 redactLaunchSecrets，token/k 查询参数替换为 [redacted]；运行态保留真实 URL，仅日志脱敏；内存/落盘/service 回调走同一边界；不带私改进程参数；修复后重记源 commit。",
      "purpose": "已知 token 泄漏在拷贝前于源头修复。",
      "verification": "含 dsh ?token= 与 magpie ?k= 的夹具在日志断言中被脱敏；正常 URL 可读；基线门禁重新全绿。",
      "estimate": "0.5 天",
      "blockedBy": [
        "T0.1"
      ],
      "evidence": [],
      "source": {
        "path": "docs/sprints/S0-w0-baseline.md",
        "sha256": "27780068ee4c4414c4d263194545cbea4af2df9443a5ad032c2c2910b8f413dc",
        "line": 10
      }
    },
    {
      "id": "T0.3",
      "sprintId": "S0",
      "title": "W0.3 统一目标仓工程身份与 workspace",
      "status": "todo",
      "summary": "根工程名 innate-desktop；workspace 登记 apps、innate-dogic 四组、innate-project-canvas；合并 onlyBuiltDependencies/allowBuilds；ui:sync 用当前目录与自动发现 innate-fe；对齐包管理器与 Node engine 并记录兼容矩阵。",
      "purpose": "目标身份与私有 UI 消费路径可重复。",
      "verification": "pnpm install 无旧 Web importer；ui:sync --dry-run 指向正确根。",
      "estimate": "0.5 天",
      "blockedBy": [
        "T0.2"
      ],
      "evidence": [],
      "source": {
        "path": "docs/sprints/S0-w0-baseline.md",
        "sha256": "27780068ee4c4414c4d263194545cbea4af2df9443a5ad032c2c2910b8f413dc",
        "line": 17
      }
    },
    {
      "id": "T0.4",
      "sprintId": "S0",
      "title": "W0.4 按白名单迁入产品与画布模块",
      "status": "todo",
      "summary": "原样复制白名单源码、resources、package/tsconfig 与 magpie.exe；保留 @dogic/* 与 @innate-labs/project-canvas 包名；不复制旧 README 文档链接与用户配置；检查 workspace 依赖可解析、无敏感文件。",
      "purpose": "计划模块全部落位且来源可追踪。",
      "verification": "pnpm -r list 列出预期模块；源码 diff 仅含 W0.2 与路径适配；敏感文件扫描无结果。",
      "estimate": "0.5 天",
      "blockedBy": [
        "T0.3"
      ],
      "evidence": [],
      "source": {
        "path": "docs/sprints/S0-w0-baseline.md",
        "sha256": "27780068ee4c4414c4d263194545cbea4af2df9443a5ad032c2c2910b8f413dc",
        "line": 24
      }
    },
    {
      "id": "T0.5",
      "sprintId": "S0",
      "title": "W0.5 迁入并适配工程工具与根脚本",
      "status": "todo",
      "summary": "迁入 smoke-desktop/verify-overlay/package-portable/check-typescript；适配 INNATE_WORKSPACE_ROOT 与相对路径；根脚本补齐全部门禁命令；新桌面构建纳入总门禁；不保留指向旧 Web 包的脚本。",
      "purpose": "一套命令验证全部已迁入模块。",
      "verification": "build/typecheck/test/check:typescript 全绿；测试数不少于 W0.1 实测。",
      "estimate": "0.5 天",
      "blockedBy": [
        "T0.4"
      ],
      "evidence": [],
      "source": {
        "path": "docs/sprints/S0-w0-baseline.md",
        "sha256": "27780068ee4c4414c4d263194545cbea4af2df9443a5ad032c2c2910b8f413dc",
        "line": 31
      }
    },
    {
      "id": "T0.6",
      "sprintId": "S0",
      "title": "W0.6 恢复桌面开发和基线行为",
      "status": "todo",
      "summary": "隔离 userData/DSH_HOME 验证 magpie 检测、模型状态、Harness 启动、控制台 Surface、工作区选根与预览、Git status/diff、overlay 7/7、Surface 切换不重载；与 labs 逐项对照，差异本阶段消除。",
      "purpose": "M0–M2 行为在目标仓恢复。",
      "verification": "verify:overlay 与 smoke:desktop 全绿；行为矩阵全部一致；日志脱敏仍有效。",
      "estimate": "0.5 天",
      "blockedBy": [
        "T0.5"
      ],
      "evidence": [],
      "source": {
        "path": "docs/sprints/S0-w0-baseline.md",
        "sha256": "27780068ee4c4414c4d263194545cbea4af2df9443a5ad032c2c2910b8f413dc",
        "line": 38
      }
    },
    {
      "id": "T0.7",
      "sprintId": "S0",
      "title": "W0.7 验证便携目录与资源完整性",
      "status": "todo",
      "summary": "构建目录型便携包；从便携目录跑真实 Electron 冒烟；关闭后无孤儿进程；包内无开发仓绝对路径、用户配置与认证信息。",
      "purpose": "便携产物可复制到干净目录运行。",
      "verification": "便携冒烟通过；资源清单与进程检查入证据。",
      "estimate": "0.5 天",
      "blockedBy": [
        "T0.6"
      ],
      "evidence": [],
      "source": {
        "path": "docs/sprints/S0-w0-baseline.md",
        "sha256": "27780068ee4c4414c4d263194545cbea4af2df9443a5ad032c2c2910b8f413dc",
        "line": 45
      }
    },
    {
      "id": "T0.8",
      "sprintId": "S0",
      "title": "W0.8 切换执行源并冻结基线",
      "status": "todo",